{
  "assignments": [
    {
      "lot_id": "L1",
      "sealed_unit_price": 12.2,
      "supplier_id": "S08",
      "supplier_surplus": 1336.0,
      "total_surplus": 4080.0,
      "true_unit_cost": 10.9
    },
    {
      "lot_id": "L2",
      "sealed_unit_price": 18.8,
      "supplier_id": "S08",
      "supplier_surplus": 1480.0,
      "total_surplus": 3800.0,
      "true_unit_cost": 16.4
    },
    {
      "lot_id": "L3",
      "sealed_unit_price": 23.2,
      "supplier_id": "S02",
      "supplier_surplus": 1818.0,
      "total_surplus": 4140.0,
      "true_unit_cost": 21.1
    },
    {
      "lot_id": "L4",
      "sealed_unit_price": 10.2,
      "supplier_id": "S02",
      "supplier_surplus": 1197.0,
      "total_surplus": 2870.0,
      "true_unit_cost": 8.9
    },
    {
      "lot_id": "L5",
      "sealed_unit_price": 30.8,
      "supplier_id": "S08",
      "supplier_surplus": 1688.0,
      "total_surplus": 3800.0,
      "true_unit_cost": 27.5
    }
  ],
  "audit_id": "v0_10x5-unsealed-v0.1.0-internal",
  "receipt_ref": "v0_10x5-unsealed-v0.1.0",
  "runtime": "unsealed",
  "scenario_hash": "sha256:dd139af3c64218632fdfbf500949ef35b0965aea00b5218e738ec12837a90e4e",
  "scenario_id": "v0_10x5",
  "surplus": {
    "buyer": 11171.0,
    "supplier": 7519.0,
    "total": 18690.0
  },
  "visibility": "internal: simulator ground truth, never part of the buyer-facing receipt"
}
